,speaker,elapsed_time,content,video-timestamp-frame number,video-timestamp-elapsed time,video-timestamp-local_time,question
0,child,0 days 00:00:00.000000000,Can we do this one? [crosstalk 00:00:07],0,0.0,2019-03-24 13:10:29,Can we do this one
1,parent,0 days 00:00:07.000000000,Hands on my head. [crosstalk 00:00:10],210,7.0,2019-03-24 13:10:35,
2,parent,0 days 00:00:09.000000000,Hands on the knees.,270,9.0,2019-03-24 13:10:37,
3,parent,0 days 00:00:11.000000000,Hands on someone else's knees.,330,11.0,2019-03-24 13:10:39,
4,parent,0 days 00:00:14.000000000,Hands on someone else's head.,420,14.0,2019-03-24 13:10:42,
5,parent,0 days 00:00:18.000000000,"Don't take off the camera 'cause it's supposed to look at you. Oh, don't play with it.",540,18.0,2019-03-24 13:10:46,
6,child,0 days 00:00:24.000000000,"Are they curious? Wait, are they looking at that one, that one, that one, that one, that one, or that one?",720,24.0,2019-03-24 13:10:52,"Are they curious::: Wait, are they looking at that one, that one, that one, that one, that one, or that one"
7,parent,0 days 00:00:29.000000000,I don't know. [crosstalk 00:00:29] Maybe all of them.,870,29.0,2019-03-24 13:10:57,
8,child,0 days 00:00:32.000000000,When can we choose it?,960,32.0,2019-03-24 13:11:00,When can we choose it
9,parent,0 days 00:00:40.000000000,When they say ready.,1200,40.0,2019-03-24 13:11:08,
10,Speaker 3,0 days 00:00:41.000000000,You can start anytime you want to now.,1230,41.0,2019-03-24 13:11:09,
11,parent,0 days 00:00:43.000000000,"Oh, we can start, okay, let's go.",1290,43.0,2019-03-24 13:11:11,
12,parent,0 days 00:00:47.000000000,Loading.,1410,47.0,2019-03-24 13:11:15,
13,parent,0 days 00:00:49.000000000,"Once upon a time, there was a little house way out in the country. She was a pretty little house, and she was strong and well built. The man who built her so well said, “This little house shall never be sold, for gold or silver, and she will live to see our great-great-grandchildren's, great-great-grandchildren living in her.”",1470,49.0,2019-03-24 13:11:17,
14,parent,0 days 00:01:15.000000000,"The little house was very happy as she sat on the hill, and watched the countryside around her. She watched the sunrise in the morning, and she watched the sunset in the evening.",2250,75.0,2019-03-24 13:11:43,
15,child,0 days 00:01:25.000000000,"Everyone [inaudible 00:01:27] 1, 2, 3, 4, 5, 6, 7, 8, 9, 10, 11, 12! 12!",2550,85.0,2019-03-24 13:11:53,
16,parent,0 days 00:01:33.000000000,Like one for each hour. Day followed day...,2790,93.0,2019-03-24 13:12:01,
17,child,0 days 00:01:40.000000000,"Okay, 13, 14, 15, 16, 17, 18, 19, 20, 21, 22, 23, 24, 25, 26!",3000,100.0,2019-03-24 13:12:08,
18,parent,0 days 00:01:50.000000000,"Oh, that's more than a day.",3300,110.0,2019-03-24 13:12:18,
19,child,0 days 00:01:51.000000000,26.,3330,111.0,2019-03-24 13:12:19,
20,parent,0 days 00:01:51.000000000,"Yeah. Day followed day, each one a little different from the one before, but the little house stayed just the same. In the night, she watched the moon grow from a thin new moon to a full moon, then back again to a thin old moon.",3330,111.0,2019-03-24 13:12:19,
21,child,0 days 00:02:10.000000000,"Let me count. 1, 2, 3, 4, 5, 6, 7, 8. Wait, let's count from 26. 27, 28, 29, 30, 31, 32, 33, 34, 35, 36, 37, 38, 39, 40, 41, 42, 43, 44, 45, 46, 47, 48, 49, 50, 51, 52, 53, 54, 55, 56. 56 [inaudible 00:02:46]",3900,130.0,2019-03-24 13:12:38,
22,parent,0 days 00:02:46.000000000,"56. And when there was no moon, she watched the stars. Way off in the distance, she could see the lights of the city. The little house was curious about the city, and wondered what it would be like to live there. Time passed quickly for the little house as she watched the countryside slowly change with the seasons. In the spring, when the days grew longer, and the sun warmer, she waited for the first robin to return from the south. She watched the grass turn green, she watched the buds on the trees swell, and the apple tree burst into blossom. She watched the children playing in the brook.",4980,166.0,2019-03-24 13:13:14,
23,parent,0 days 00:03:27.000000000,"In the long summer days, she sat in the sun, and watched the trees cover themselves with leaves, and the white daisy's cover the hill. She watched the gardens grow, and she watched the apples turn red and ripen, and she watched children swimming in the pool. In the fall, when the days grew shorter, the nights colder, she watched the first frost turn the leaves to bright yellow, and orange, and red. She watched the harvest gathered and the apples picked. She watched the children going back to school. In the winter, when the nights were long, and the days were short, and the countryside covered with snow, she watched the children coasting, and skating.",6210,207.0,2019-03-24 13:13:55,
24,parent,0 days 00:04:10.000000000,"Year followed year, the apple trees grew old, and new ones were planted. The children grew up and went away to the city, and now at night, the lights of the city seem brighter and closer. One day, the little house was so surprised to see a horseless carriage coming down the winding country road. Do you know what a horseless carriage is?",7500,250.0,2019-03-24 13:14:38, Do you know what a horseless carriage is
25,child,0 days 00:04:32.000000000,No.,8160,272.0,2019-03-24 13:15:00,
26,parent,0 days 00:04:34.000000000,"What do you think we drive in? Car? There are no horses. Anyway, pretty soon, there were more of them on the road and fewer carriages pulled by horses. Pretty soon, along came some surveyors and surveyed a line in front of the little house. Pretty soon, along came a steam shovel, and dug a road through the hill covered with daisy's. Then some trucks came and dumped big stones on the road. Then some trucks with little stones. Then some trucks with tar, and sand. And finally a steam roller came, and rolled it all smooth, and the road was done.",8220,274.0,2019-03-24 13:15:02,What do you think we drive in::: Car
27,parent,0 days 00:05:17.000000000,"Now the little house watched the trucks and automobiles going back and forth to the city. Gasoline stations, road side stands, and small houses followed the new road. Everyone and everything moved faster now than before. More roads were made and the countryside was divided into lots. More houses and bigger houses. Apartment houses and tenement houses. Schools, stores, and garages spread over the land, and crowded around the little house. No one wanted to live in her, and take care of her anymore. She couldn't be sold for silver gold, so she just stayed there and watched.",9510,317.0,2019-03-24 13:15:45,
28,parent,0 days 00:05:58.000000000,"Now it was not so quiet and peaceful at night. Now the lights of the city were bright, and very close, and the street light shown all night. “This must be living in the city,” thought the little house, and didn't know whether she liked it or not. She missed the fields of daisy's, and the apple trees dancing in the moon light. Pretty soon, there were trolley cars going back and forth in front of the little house. They went back and forth all day, and part of the night. Everyone seemed to be very busy, and everyone seemed to be in a hurry.",10740,358.0,2019-03-24 13:16:26,
29,parent,0 days 00:06:31.000000000,"Pretty soon, there was an elevated train going back and forth above the little house. The air was filled with dust and smoke, and the noise was so loud that it shook the little house. Now she couldn't tell when spring came, or summer, or fall, or winter. It all seemed about the same. Pretty soon, there was a subway going back and forth under the little house. She couldn't see it but she could feel and hear it. People were moving faster and faster.",11730,391.0,2019-03-24 13:16:59,
30,child,0 days 00:07:00.000000000,There's 3 subways.,12600,420.0,2019-03-24 13:17:28,
31,parent,0 days 00:07:01.000000000,3 subways? Where?,12630,421.0,2019-03-24 13:17:29,3 subways::: Where
32,child,0 days 00:07:04.000000000,"I mean, 3 trains.",12720,424.0,2019-03-24 13:17:32,
33,parent,0 days 00:07:06.000000000,Yeah.,12780,426.0,2019-03-24 13:17:34,
34,child,0 days 00:07:07.000000000,"1, 2, 3!",12810,427.0,2019-03-24 13:17:35,
35,parent,0 days 00:07:09.000000000,"Oh my goodness, that's a lot of trains.",12870,429.0,2019-03-24 13:17:37,
36,child,0 days 00:07:11.000000000,That's a elevators.,12930,431.0,2019-03-24 13:17:39,
37,parent,0 days 00:07:12.000000000,Yes.,12960,432.0,2019-03-24 13:17:40,
38,child,0 days 00:07:14.000000000,"One, I like that.",13020,434.0,2019-03-24 13:17:42,
39,parent,0 days 00:07:18.000000000,Yeah.,13140,438.0,2019-03-24 13:17:46,
40,child,0 days 00:07:18.000000000,I think...,13140,438.0,2019-03-24 13:17:46,
41,parent,0 days 00:07:18.000000000,It seems very efficient.,13140,438.0,2019-03-24 13:17:46,
42,child,0 days 00:07:24.000000000,"I really like that. I think she should stay, because that's like cool.",13320,444.0,2019-03-24 13:17:52,
43,parent,0 days 00:07:31.000000000,"I think it's cool too, but some people don't like city, so, and trains.",13530,451.0,2019-03-24 13:17:59,
44,parent,0 days 00:07:37.000000000,"People were moving faster and faster. No one noticed that little house anymore, they hurried by without a glance. Pretty soon, they tore down the apartment houses and tenement houses around the little house, and started digging big cellars, one on each side. The steam shovels, dug down 3 stories on one side, and 4 stories on the other side. Pretty soon, they started building up. They built up 25 stories on one side, and 35 stories on the other. Now the little house only saw the sun at noon, and didn't see the moon or starts at night at all, because the lights of the city were too bright. She didn't like living in the city. At night, she used to dream of the country, and the fields of daisy's, and the apple trees dancing in the moon light.",13710,457.0,2019-03-24 13:18:05,
45,parent,0 days 00:08:25.000000000,"The little house was very sad and lonely. Her paint was cracked and dirty. Her windows were broken, and her shutters were hung crookedly. She looked shabby, though she was just as good a house as ever underneath. Then one fine morning in spring, along came the great...",15150,505.0,2019-03-24 13:18:53,
46,child,0 days 00:08:45.000000000,Where's the one under.,15750,525.0,2019-03-24 13:19:13,
47,parent,0 days 00:08:46.000000000,"There she is... [crosstalk 00:08:48] Oh, the other trains? I don't know, maybe, oh it's cause it's underground, you can't see it unless they show you. And they're just showing you what's above ground.",15780,526.0,2019-03-24 13:19:14," [crosstalk 00:08:48] Oh, the other trains"
48,child,0 days 00:08:59.000000000,Oh.,16170,539.0,2019-03-24 13:19:27,
49,parent,0 days 00:08:59.000000000,"Along came the great-great-granddaughter of the man who built the little house so well. She saw the shabby little house, but she didn't hurry by. There was something about the little house that made her stop and look again. She said to her husband, “That little house looks just like the little house my grandmother lived in when she was a little girl. Only, that little house, was way out in the country on a hill covered with daisy's, and apple trees growing around.” They found out it was the same, very same house, so they went to the movers to see if the little house could be moved. The movers looked at the little house all over, and said, “Sure! This house is as good as ever! She's built so well, we could mover her anyway... anywhere.” So they jacked up the little house that she...",16170,539.0,2019-03-24 13:19:27,
50,child,0 days 00:09:48.000000000,"This picture looks, looks all the same.",17640,588.0,2019-03-24 13:20:16,
51,parent,0 days 00:09:51.000000000,"Yeah, well, sometimes it's the same one twice in a row.",17730,591.0,2019-03-24 13:20:19,
52,parent,0 days 00:09:55.000000000,"Traffic was held up for hours, as they slowly moved her out of the city. I'm sure people trying to get to work loved that. At first, the little house was frightened, but after she got used to it, she really liked it. They rolled along the big road, and they rolled along the little roads, until they were way out in the country. When the little house saw the green grass, and heard the birds singing, she didn't feel sad anymore. They went along, and along...",17850,595.0,2019-03-24 13:20:23,
53,child,0 days 00:10:21.000000000,The last one was spring. Did she notice spring now?,18630,621.0,2019-03-24 13:20:49, Did she notice spring now
54,parent,0 days 00:10:27.000000000,"But they couldn't seem to find the right place. They tried the little house here, and they tried her there, they finally saw a little hill in the middle of a field, and apple trees growing around. “There!”, said the great-great-granddaughter...",18810,627.0,2019-03-24 13:20:55,
55,child,0 days 00:10:40.000000000,Is it summer or spring?,19200,640.0,2019-03-24 13:21:08,Is it summer or spring
56,parent,0 days 00:10:46.000000000,"I don't know, what do you think?",19380,646.0,2019-03-24 13:21:14,"I don't know, what do you think"
57,child,0 days 00:10:46.000000000,Spring!,19380,646.0,2019-03-24 13:21:14,
58,parent,0 days 00:10:46.000000000,I think spring too. That's just the place.,19380,646.0,2019-03-24 13:21:14,
59,child,0 days 00:10:48.000000000,I think it's almost summer.,19440,648.0,2019-03-24 13:21:16,
60,parent,0 days 00:10:50.000000000,Maybe.,19500,650.0,2019-03-24 13:21:18,
61,child,0 days 00:10:50.000000000,But not yet.,19500,650.0,2019-03-24 13:21:18,
62,parent,0 days 00:10:52.000000000,Like your birthday.,19560,652.0,2019-03-24 13:21:20,
63,child,0 days 00:10:53.000000000,Mm-hmm (affirmative).,19590,653.0,2019-03-24 13:21:21,
64,parent,0 days 00:10:54.000000000,Maybe.,19620,654.0,2019-03-24 13:21:22,
65,parent,0 days 00:10:54.000000000,"“Yes it is!”, said the little house to herself. A cellar was dug on top of the hill, and slowly they moved the house from the road to the hill. The windows, and shutters were fixed, and once again, they painted her a lovely shade of pink. As the little house settled down on her new foundation, she smiled happily. Once again, she could watch the sun, and moon, and stars. Once again she could watch spring, and summer, and fall, and winter, come and go. Once again she was lived in, and taken care of.",19620,654.0,2019-03-24 13:21:22,
66,parent,0 days 00:11:32.000000000,"Never again would she be curious about the city. Never again would she want to live there. The stars twinkled above her, a new moon was coming up. It was spring, and all was quiet and peaceful in the country. The end.",20760,692.0,2019-03-24 13:22:00,
67,parent,0 days 00:11:51.000000000,"Bookshelf, there you go. Okay, you want another one?",21330,711.0,2019-03-24 13:22:19," Okay, you want another one"
68,parent,0 days 00:11:55.000000000,The Lorax? Okay.,21450,715.0,2019-03-24 13:22:23,The Lorax
69,parent,0 days 00:12:03.000000000,"At the far end of town, where the grickle grass grows, and the wind smells slow and sour when it blows, and no birds ever sing excepting old crows, is the street of the lifted Lorax.",21690,723.0,2019-03-24 13:22:31,
70,parent,0 days 00:12:19.000000000,"Something to sleep, the grickle grass some people say, if you look deep enough, you can still see today. Where the Lorax once stood, just as long as it could, before somebody lifted the Lorax away. What was the Lorax? And why was it there? And why was it lifted and taken somewhere? From the far end of town, where the grickle grass grows, the old Once-ler still lives here. Ask him, he knows.",22170,739.0,2019-03-24 13:22:47, What was the Lorax::: And why was it there::: And why was it lifted and taken somewhere
71,parent,0 days 00:12:50.000000000,"You won't see the Once-ler, don't knock at his door, he stays in his lerkim, on top of his store. He lurks in his lerkim, cold under the roof, where he makes his own clothes out of miff-muffered moof. And on special nights in August, he peeks out of shutters, and sometimes he speaks, and tell how the Lorax was lifted away. He'll tell you perhaps, if you're willing to pay.",23100,770.0,2019-03-24 13:23:18,
72,parent,0 days 00:13:18.000000000,"On the end of a rope, he lets down a tin pail, and you have to toss in 15 cents, and a nail, and the shell of a great-great-great-grandfather snail. Then he pulls up the pail, and makes a most careful count, to see if you've paid him the proper amount. Then he hides what you paid him, away in his snuvv, his secret strange hole, in his gruvvulouse glove.",23940,798.0,2019-03-24 13:23:46,
73,parent,0 days 00:13:47.000000000,"Then he grunts, “I will call you by whisper-ma-phone, for the secrets I tell you are for your ears alone."" Slupp Down slupps the whisper-ma-phone to your ear, and the old Once-ler's whispers are not very clear, since they have to come down through a snergelly hose, and he sounds as if he had smallish bees up his nose. “Now I'll tell you,” he says with his teeth sounding gray, ""how the Lorax got lifted and taken away. It all started back such a long, long time back. Way back in the days when the grass was still green, and the pond was still wet, and the clouds were still clean, and the song of the swomee-swans rang out in space. One morning I came to this glorious place, and I first saw the trees, the truffula trees. The bright-colored tufts of the truffula trees. Miles after mile in the fresh morning breeze.""",24810,827.0,2019-03-24 13:24:15,
74,parent,0 days 00:14:46.000000000,"""And under the trees, I saw brown bar-ba-loots frisking about in their bar-ba-loot suits, and they played in the shade, and ate truffula fruits. From the rippulous pond came the comfortable sound of the humming-fish humming while splashing around. But those trees, those trees, those truffula trees. All my life I've been searching for trees such as these. The touch of their tufts was much softer then silk, and they had the sweet smell of fresh butterfly milk. I felt a great leaping of joy in my heart, I knew just what I'd do, I unloaded my cart.""",26580,886.0,2019-03-24 13:25:14,
75,parent,0 days 00:15:28.000000000,"""In no time at all, I had built a small shop. Then I chopped down a truffula tree with one chop, and with great skillful skill, and with great speedy speed, I took the soft tuft, I knitted a thneed.""",27840,928.0,2019-03-24 13:25:56,
76,parent,0 days 00:15:43.000000000,"""The instant I'd finished, I'd heard a ga-zump, I looked. I saw something pop out of the stump, of the tree I'd chopped down. It was sort of a man. Describe him? That's hard, I don't know if I can. He was shortish, and oldish, and brownish, and mossy, and he spoke with a voice that was sharpish and bossy.""",28290,943.0,2019-03-24 13:26:11,
77,parent,0 days 00:16:08.000000000,"“Mister!,” he said, with a saw dusty sneeze, “I am the Lorax, I speak for the trees! I speak for the trees, for the trees have no tongues, and I'm asking you sir at the top of my lungs!” He was very upset as he shouted, and puffed. “What's that thing you've made out of my truffula tuft?”",29040,968.0,2019-03-24 13:26:36, “What's that thing you've made out of my truffula tuft
78,parent,0 days 00:16:28.000000000,"“Look Lorax,” I said, “there's no card for alarm, I just chopped one tree, I'm doing no harm. I'm being quite useful. This thing is a thneed! A thneed's a fine something that all people need. It's a shirt, it's a sock, it's a glove, it's a hat, but it has other uses, yes, far beyond that. You can use it for carpets, for pillows, for sheets, or curtains, or covers for bicycle seats.”",29640,988.0,2019-03-24 13:26:56,
79,parent,0 days 00:16:53.000000000,"The Lorax said, “ Sir, you are crazy with greed. There's no one on earth who would buy that fool thneed!”",30390,1013.0,2019-03-24 13:27:21,
80,parent,0 days 00:17:01.000000000,"But the very next minute, I proved he was wrong. For just at that minute, a chap came along, and he thought that the thneed I had knitted was great, and he happily bought if for $3.98. I laughed at the Lorax, “You poor stupid guy, you never can tell what some people will buy.”",30630,1021.0,2019-03-24 13:27:29,
81,parent,0 days 00:17:21.000000000,"“I repeat!” Said the Lorax, “I speak for the trees,”",31230,1041.0,2019-03-24 13:27:49,
82,parent,0 days 00:17:25.000000000,"“I'm busy!” I told him, “Shut up, if you please.”",31350,1045.0,2019-03-24 13:27:53,
83,parent,0 days 00:17:28.000000000,"I rushed across the room, and at no time at all, built a radio phone. I put in a quick call. I called on my brothers, and uncles, and aunts, and I said, “listen here, here's a wonderful chance for the whole Once-ler family to get mighty rich. Get over here fast, take the road to North Nitch, turn left at Weehawken, sharp right at South Stitch.”",31440,1048.0,2019-03-24 13:27:56,
84,parent,0 days 00:17:51.000000000,"And in no time at all, in the factory I built, the whole Once-ler family was working full tilt. They were all knitting thneed's, busy as bees to the sound of the chopping of truffula trees. Then, oh baby, oh, how my business did grow. Now chopping one tree at a time was too slow. So I quickly invented my super-axe-hacker, which whacked off 4 truffula trees in once smacker. We were making thneeds 4 times as fast as before, and that Lorax, he didn't show up anymore.",32130,1071.0,2019-03-24 13:28:19,
85,parent,0 days 00:18:25.000000000,"But the next week, he knocked on my new office door. He snapped, “I am the Lorax, who speaks for the trees, which you seem to be chopping as fast as you please. But I'm also in charge of the brown bar-ba-loots, who played in the shade in their bar-ba-loot suits, and happily lived eating truffula fruits. Now, thanks to your hacking my trees to the ground, there's not enough truffula fruit to go 'round. And my poor bar-ba-loots are all getting the crummies because they have gas and no food in their tummies. They loved living here, but I can't let them stay. They'll have to find food, and I hope that they may.""",33150,1105.0,2019-03-24 13:28:53,
86,child,0 days 00:19:06.000000000,"It looks, smaller, and smaller.",34380,1146.0,2019-03-24 13:29:34,
87,parent,0 days 00:19:08.000000000,"Yeah, it does.",34440,1148.0,2019-03-24 13:29:36,
88,child,0 days 00:19:08.000000000,Why?,34440,1148.0,2019-03-24 13:29:36,Why
89,parent,0 days 00:19:11.000000000,Because he's chopping down all the trees.,34530,1151.0,2019-03-24 13:29:39,
90,child,0 days 00:19:13.000000000,What's these? There?,34590,1153.0,2019-03-24 13:29:41,What's these::: There
91,parent,0 days 00:19:17.000000000,The truffula... 'cause they're getting further away.,34710,1157.0,2019-03-24 13:29:45,
92,child,0 days 00:19:19.000000000,"Oh, because the smaller ones are going food?",34770,1159.0,2019-03-24 13:29:47,"Oh, because the smaller ones are going food"
93,parent,0 days 00:19:26.000000000,That could be too.,34980,1166.0,2019-03-24 13:29:54,
94,child,0 days 00:19:29.000000000,They look really cute.,35070,1169.0,2019-03-24 13:29:57,
95,parent,0 days 00:19:31.000000000,"They do, but they look really sad.",35130,1171.0,2019-03-24 13:29:59,
96,parent,0 days 00:19:36.000000000,"“Good luck boys!”, he cried, as he sent them away. I the Once-ler felt sad as I watched them all go, but business is business, and business must grow regaurdless of crummies, and tummies you know. I meant no harm, I most truly did not, but I had to grow bigger, so bigger I got. I biggered my factory, I biggered my roads, I biggered my wagons, I biggered the loads of the thneeds I shipped out. I was shipping them forth, to the south, to the east, to the west, to the north. I went right on biggering, selling more thneeds, and I biggered my money, which everyone needs.",35280,1176.0,2019-03-24 13:30:04,
97,parent,0 days 00:20:17.000000000,"Then again he came back, I was fixing some pipes, when that old nuisance Lorax came back with more gripes. “I am the Lorax!”, he coughed, and he whiffed. He sneezed, and he snuffled, he snargled, he sniffed. “Once-ler!”, he cried, with a cruffulous croak, “Once-ler, you're making such smogulous smoke! My poor swomee-swans, why they can't sing a note! No one who can sing who has smog in his throat. And so,” said the Lorax, “Please pardon my cough, they cannot live here, so I'm sending them off. Where will they go? I don't hopefully know, they may escape to fly for a month, or a year to escape from the smog, you've smogged up around here. What's more!” snapped the Lorax, his dander was up, “let me say a few words about gluppity-glupp. Your machine chugs on day and night without stop, making gluppity-glupp also schloppity-schlopp. And what do you do with this left over goo? I'll show you, you dirty old Once-ler man you!”",36510,1217.0,2019-03-24 13:30:45, Where will they go::: And what do you do with this left over goo
98,parent,0 days 00:21:23.000000000,"“Your glumping the pond, where the humming-fish hummed. No more can they hum for their gills are all gummed. So I'm sending them off. Oh, their future is dreary. They'll walk on their fins, and they'll get woefully weary in search of some water that isn't so smeary.”",38490,1283.0,2019-03-24 13:31:51,
99,parent,0 days 00:21:40.000000000,"And then I got mad, I got terribly mad. I yelled at the Lorax, ""Now listen here dad! All you do is yap-yap, and say bad! Bad! Bad...""",39000,1300.0,2019-03-24 13:32:08,
100,child,0 days 00:21:49.000000000,Why did he call him dad?,39270,1309.0,2019-03-24 13:32:17,Why did he call him dad
101,parent,0 days 00:21:51.000000000,"'cause he's acting like a father, by telling him what to do, and he doesn't like it.",39330,1311.0,2019-03-24 13:32:19,
