,speaker,elapsed_time,content,video-timestamp-frame number,video-timestamp-elapsed time,video-timestamp-local_time,question
102,parent,0 days 00:21:57.000000000,"""Well, I have my rights sir, and I'm telling you I intend to go on doing just what I do. And for your information, you Lorax, I'm figuring on biggering, and biggering, and biggering, and BIGGERING, turning more truffula trees into thneeds which everyone, everyone, EVERYONE needs!”",39510,1317.0,2019-03-24 13:32:25,
103,parent,0 days 00:22:17.000000000,"And at that very moment, we heard a loud WHACK, from outside in the fields came a sickening smack of an axe on a tree, then we heard the tree fall. The very last truffula tree of them all. No more trees, no more thneeds, no more work to be done. So, in time my uncles, and aunts, everyone all waved me goodbye. They jumped into my cars, and drove away under the smoke-smuggered stars. Now all that was left the bad smelling sky, was my big empty factory, the Lorax, and I. The Lorax said nothing, just gave me a glance, just gave me a very sad, sad backwards glance as he lifted himself by the seat of his pants. And I'll never forget the grim look on his face, when he heisted himself, and took leave of this place through a hole in the smog without leaving a trace. And all that the Lorax left here, is this mess, was a small pile of rocks, with the one word unless.",40110,1337.0,2019-03-24 13:32:45,
104,parent,0 days 00:23:26.000000000,"Whatever that meant. Well, I just couldn't guess. That was long, long ago, but each day since that day, I've sat here and worried, and worried, and worried away, through the years while my buildings have fallen apart, I've worried about it with all of my heart. “But now,” said the Once-ler, ""now that you're here, the word of the Lorax seemed perfectly clear. Unless someone like you cares a whole awful lot, nothing is going to get better, it's not! So, “Catch!,” calls the Once-ler, he lets something fall, “It's a truffula seed, it's the last one of all.”",42180,1406.0,2019-03-24 13:33:54,
105,parent,0 days 00:24:05.000000000,What are you doing?,43350,1445.0,2019-03-24 13:34:33,What are you doing
106,parent,0 days 00:24:07.000000000,"“You're in charge of the last of the truffula seeds, and the truffula trees are what everyone needs. Plant a new truffula, treat it with care. Give it clean water, and feed it fresh air. Grow a forest, protect it from axes that hack. Then the Lorax, and all of his friends may come back.” The end.",43410,1447.0,2019-03-24 13:34:35,
107,Speaker 3,0 days 00:24:28.000000000,I think it's about time.,44040,1468.0,2019-03-24 13:34:56,
108,parent,0 days 00:24:29.000000000,Okay. We are all done.,44070,1469.0,2019-03-24 13:34:57,
109,child,0 days 00:24:32.000000000,"After we read 2 long stories, we're done!",44160,1472.0,2019-03-24 13:35:00,
110,parent,0 days 00:24:35.000000000,Yes! Just like last time. Okay. [inaudible 00:24:41],44250,1475.0,2019-03-24 13:35:03,
111,parent,0 days 00:24:41.000000000,"Wait, we gotta do your [crosstalk 00:24:43]",44430,1481.0,2019-03-24 13:35:09,
112,Speaker 3,0 days 00:24:45.000000000,You can take off your watch.,44550,1485.0,2019-03-24 13:35:13,
113,parent,0 days 00:24:46.000000000,Okay. [inaudible 00:24:48] Thank you.,44580,1486.0,2019-03-24 13:35:14,
114,Speaker 3,0 days 00:25:00.000000000,Thank you so much. [inaudible 00:25:00],45000,1500.0,2019-03-24 13:35:28,
115,parent,0 days 00:25:19.000000000,"Okay, your friend is here.",45570,1519.0,2019-03-24 13:35:47,
116,Speaker 3,0 days 00:25:25.000000000,"Okay, we're gonna play with [inaudible 00:25:25]",45750,1525.0,2019-03-24 13:35:53,
